{
"$schema": "http://json-schema.org/draft-04/schema",
"title": "exit",
"type": "object",
"$schema": "http://json-schema.org/draft-04/schema",
  "required":["ExitID","ProjectEntryID","DateCreated","ExitDate","DateUpdated","UserID"],
"properties": {
  "ExitID": {
    "type": "string",
    "maxLength": 32,
    "minLength": 32
  },
  "ProjectEntryID": {
    "type": "string",
    "maxLength": 32,
    "minLength": 32
  },
  "ExitDate": {
    "type": "string",
    "format": "date-time"
  },
  "Destination": {
    "type": "integer"
  },
  "OtherDestination": {
    "type": "string",
    "maxLength": 50
  },
  "DateCreated": {
    "type": "string",
    "format": "date-time"
  },
  "DateUpdated": {
    "type": "string",
    "format": "date-time"
  },
  "DateDeleted": {
    "type": "string",
    "format": "date-time"
  },
  "UserID": {
    "type": "string",
    "maxLength": 32,
    "minLength": 32}
  }
}
