{
  "ExitID":"9d57c33f-cc4e-47ff-8bbd-0580e7a0",
  "ProjectEntryID":"9d57c33f-cc4e-47ff-8bbd-0580e7a0",
  "ExitDate":"1997-07-16T19:20:30.45+01:00",
  "Destination":24,
  "OtherDestination":"Test destination",
  "DateCreated":"1997-07-16T19:20:30.45+01:00",
  "DateUpdated":"1997-07-16T19:20:30.45+01:00",
  "DateDeleted":"1997-07-16T19:20:30.45+01:00",
  "UserID":"9d57c33f-cc4e-47ff-8bbd-0580e7a0"
}